id,nama,alamat,latitude,longitude,jam operasional,nomer telepon,informasi tambahan,Name
1,SMA Negeri 1 Lawang,"Jl. Pramuka No.152, Krajan, Kalirejo, Kec. Lawang, Kabupaten Malang, Jawa Timur 65216",-7.84154,112.70028,Senin-Jumat 07.00-15.00,62341426265,Sekolah Menengah Atas di Jawa Timur,D:\TEKO HARDISK LAWAS\Kuliah\Semester 4\Sistem Informasi Geografis\UAS\Foto SMA\sman1.jpg
2,SMA Maarif Lawang,"5M6X+9C8, Lawang, Kec. Lawang, Kabupaten Malang, Jawa Timur 65211",-7.83882,112.69867,Senin-Sabtu 06.30-14.20,62341422122,Sekolah Menengah Atas Swasta di Jawa Timur,D:\TEKO HARDISK LAWAS\Kuliah\Semester 4\Sistem Informasi Geografis\UAS\Foto SMA\smamala.jpg
3,SMA Aisyiyah Boarding School Malang,"Turi, Turirejo, Kec. Lawang, Kabupaten Malang, Jawa Timur 65213",-7.82581,112.69589,Setiap Hari 06.30-17.00,6.23414E+11,Sekolah Menengah Atas Swasta di Jawa Timur,D:\TEKO HARDISK LAWAS\Kuliah\Semester 4\Sistem Informasi Geografis\UAS\Foto SMA\smaaisyah.jpg
4,SMK Mutiara Harapan Lawang,"Jalan Masjid Walisongo, Ketindan, Lawang, Malang, Jawa Timur malang, Krajan, Ketindan, Kec. Lawang, Kabupaten Malang, Jawa Timur 65214",-7.83573,112.68488,Senin-Sabtu 07.00-15.00,62341428575,Sekolah Menengah Kejuruan Swasta di Jawa Timur,D:\TEKO HARDISK LAWAS\Kuliah\Semester 4\Sistem Informasi Geografis\UAS\Foto SMA\smkmutiara.jpg
5,SMK KOSGORO 1 Lawang,"Jl. Madukoro No.14, Lawang, Kec. Lawang, Kabupaten Malang, Jawa Timur 65211",-7.83301,112.69921,Senin-Jumat 07.00-17.00,62341426161,Sekolah Menengah Kejuruan Swasta di Jawa Timur,D:\TEKO HARDISK LAWAS\Kuliah\Semester 4\Sistem Informasi Geografis\UAS\Foto SMA\smkkosgoro.jpg
